,job_title,company,location,remote_work_allowed,job_description,job_details,company_details,link,skills_required
0,Machine Learning Engineer 5,Adobe,"Noida, Uttar Pradesh, India",False,"{'description': 'Our Company\n\nChanging the world through digital experiences is what Adobe’s all about. We give everyone—from emerging artists to global brands—everything they need to design and deliver exceptional digital experiences! We’re passionate about empowering people to create beautiful and powerful images, videos, and apps, and transform how companies interact with customers across every screen.\n\nWe’re on a mission to hire the very best and are committed to creating exceptional employee experiences where everyone is respected and has access to equal opportunity. We realize that new ideas can come from everywhere in the organization, and we know the next big idea could be yours!\n\nExcited by AI/ML? Interested in creating new innovative solutions using Machine Learning. The Document Cloud team, in Noida, is creating PDF solutions spanning all surfaces - Web, Mobile, Desktop and Platform APIs, that processes billions of PDFs every month using ML, Deep-Learning and Generative AI at its core.\n\nAs a part of this, we need experienced individuals focusing on research and development of methods for processing huge amount of content, and can build mashups of Vision, Image Processing, NLP, generative models to solve complex problems.\n\nWhat you get to do in this role:\n\nDevelop algorithms that apply deep learning and state of the art methods in NLP & computer vision, combined with traditional large sophisticated solutions/codebases. Create experiments, algorithms and ship solution that not only yield high accuracy but are also designed and engineered to scale. Collaborate across multiple research and engineering disciplines, making the tradeoffs required to rapidly deliver AI/ML software solutions. \n\nIn order to be successful, we need someone who has:\n\nB.Tech in Computer Science. MS/PhD preferred. 3+ years hands-on experience in either deep-learning models, Image processing, Vision and/or NLP. Ability to write efficient, clean, and reusable code in Python. Knowledge of C++ is preferred. Broad Machine Learning experience – Data, Modelling, Metric, Analysis of Results. Experience in using TensorFlow or PyTorch. Exposure to Deep Learning - CNNs, LSTMs, Transformers, network architecture, network tuning, transfer learning, multi-task learning. Exposure in building solutions from scratch and writing maintainable code inside large existing codebases. Strong software development skills that encourage code reuse among engineers and researchers. Experience in building AI applications for multiple locales will be preferred\n\nAdobe is proud to be an Equal Employment Opportunity and affirmative action employer. We do not discriminate based on gender, race or color, ethnicity or national origin, age, disability, religion, sexual orientation, gender identity or expression, veteran status, or any other applicable characteristics protected by law. Learn more.\n\nAdobe aims to make Adobe.com accessible to any and all users. If you have a disability or special need that requires accommodation to navigate our website or complete the application process, email accommodations@adobe.com or call (408) 536-3015.\n\nAdobe values a free and open marketplace for all employees and has policies in place to ensure that we do not enter into illegal agreements with other companies to not recruit or hire each other’s employees.'}","{'employment_type': None, 'seniority_level': None, 'job_functions': [], 'industries': [], 'remote_work_allowed': False, 'job_description': {'description': 'Our Company\n\nChanging the world through digital experiences is what Adobe’s all about. We give everyone—from emerging artists to global brands—everything they need to design and deliver exceptional digital experiences! We’re passionate about empowering people to create beautiful and powerful images, videos, and apps, and transform how companies interact with customers across every screen.\n\nWe’re on a mission to hire the very best and are committed to creating exceptional employee experiences where everyone is respected and has access to equal opportunity. We realize that new ideas can come from everywhere in the organization, and we know the next big idea could be yours!\n\nExcited by AI/ML? Interested in creating new innovative solutions using Machine Learning. The Document Cloud team, in Noida, is creating PDF solutions spanning all surfaces - Web, Mobile, Desktop and Platform APIs, that processes billions of PDFs every month using ML, Deep-Learning and Generative AI at its core.\n\nAs a part of this, we need experienced individuals focusing on research and development of methods for processing huge amount of content, and can build mashups of Vision, Image Processing, NLP, generative models to solve complex problems.\n\nWhat you get to do in this role:\n\nDevelop algorithms that apply deep learning and state of the art methods in NLP & computer vision, combined with traditional large sophisticated solutions/codebases. Create experiments, algorithms and ship solution that not only yield high accuracy but are also designed and engineered to scale. Collaborate across multiple research and engineering disciplines, making the tradeoffs required to rapidly deliver AI/ML software solutions. \n\nIn order to be successful, we need someone who has:\n\nB.Tech in Computer Science. MS/PhD preferred. 3+ years hands-on experience in either deep-learning models, Image processing, Vision and/or NLP. Ability to write efficient, clean, and reusable code in Python. Knowledge of C++ is preferred. Broad Machine Learning experience – Data, Modelling, Metric, Analysis of Results. Experience in using TensorFlow or PyTorch. Exposure to Deep Learning - CNNs, LSTMs, Transformers, network architecture, network tuning, transfer learning, multi-task learning. Exposure in building solutions from scratch and writing maintainable code inside large existing codebases. Strong software development skills that encourage code reuse among engineers and researchers. Experience in building AI applications for multiple locales will be preferred\n\nAdobe is proud to be an Equal Employment Opportunity and affirmative action employer. We do not discriminate based on gender, race or color, ethnicity or national origin, age, disability, religion, sexual orientation, gender identity or expression, veteran status, or any other applicable characteristics protected by law. Learn more.\n\nAdobe aims to make Adobe.com accessible to any and all users. If you have a disability or special need that requires accommodation to navigate our website or complete the application process, email accommodations@adobe.com or call (408) 536-3015.\n\nAdobe values a free and open marketplace for all employees and has policies in place to ensure that we do not enter into illegal agreements with other companies to not recruit or hire each other’s employees.'}, 'job_url': {'com.linkedin.voyager.jobs.OffsiteApply': {'applyStartersPreferenceVoid': True, 'companyApplyUrl': 'https://careers.adobe.com/us/en/job/ADOBUSR146625EXTERNALENUS/Machine-Learning-Engineer-5?utm_medium=phenom-feeds&source=LinkedIn&utm_source=linkedin', 'inPageOffsiteApply': False}}}","{'company_name': 'Adobe', 'company_url': 'https://www.linkedin.com/company/adobe'}",https://www.linkedin.com/jobs/view/3992337162/,"Artificial Intelligence (AI), Computer Vision, Data Science, Engineering Disciplines, Image Processing, Machine Learning, Natural Language Processing (NLP), Pattern Recognition, PyTorch, TensorFlow"
1,Machine Learning Engineer,Onclusive,India,True,"{'description': ""About the Role:As a Senior Machine Learning Operations Engineer, you will work on maintaining and building new features for our machine learning platform that supports prediction for large language models on a vast amount of text. You will apply your technical knowledge and Big Data analytics on Onclusive’s billions of online content data points to solve challenging marketing problems. ML Ops Engineers are integral to the success of Onclusive. You'll be an essential catalyst for Onclusive's success. Collaborating closely with our engineering, product, and core teams, you'll be entrusted with designing and implementing containerized runtime environments. These environments are the bedrock of efficient model development and deployment for ML/AI solutions, paving the way for predictive breakthroughs.\nYour responsibilities:Building and enhancing features within our machine learning platform to expedite ML-based solution development company-wide.Elevating system maintainability by establishing a unified infrastructure, streamlined orchestration, and vigilant monitoring.Mastering MLOps and CI/CD best practices to orchestrate seamless, automated build and deployment pipelines of our services.Harnessing your Unix-based systems knowledge to ensure the smooth functioning of ML/AI software and frameworks.Crafting illustrative example notebooks to empower machine learning engineers in leveraging our internal tools to streamline model research and development.Guiding and nurturing junior engineers, instilling them with MLOPs excellence and the intricacies of diverse frameworks we leverage in our day-to-dayPioneering research into open-source tools and industry-leading MLOps and Platform strategies, steering us toward top-tier technology solutions.\nWho you are:A degree (BS, MS, or Ph.D.) in Computer Science or a related field, accompanied by hands-on experience.You will have 5 years + using a similar tech stack.Proficiency in Python, showcasing your understanding of Object-Oriented Programming (OOP) principles.Solid knowledge of containerisation (Docker preferable)Experience working with Kubernetes.Experience in Infrastructure as Code (IAC) for AWS, with a preference for Terraform.Knowlede of Version Control Systems (VCS), particularly Git and GitHub, alongside familiarity with CI/CD, preferably GitHub Actions.Understanding of release management, embracing rigorous testing, validation, and quality assurance protocols.Good understanding of ML principlesExposure to deep learning tech-stacks like Torch / Tensorflow, and Transformers.\nWhat we can offer:We are a global fast growing company which offers a variety of opportunities for you to develop your skill set and career. In exchange for your contribution, we can offer you:Competitive salary and benefitsHybrid working in a team that is passionate about the work we deliver and supporting the development of those that we work withA company focus on wellbeing and work life balance including initiative’s such as flexible working and mental health support We want the best talent available, regardless of race, religion, gender, gender reassignment, sexual orientation, marital status, pregnancy, disability or age.""}","{'employment_type': None, 'seniority_level': None, 'job_functions': [], 'industries': [], 'remote_work_allowed': True, 'job_description': {'description': ""About the Role:As a Senior Machine Learning Operations Engineer, you will work on maintaining and building new features for our machine learning platform that supports prediction for large language models on a vast amount of text. You will apply your technical knowledge and Big Data analytics on Onclusive’s billions of online content data points to solve challenging marketing problems. ML Ops Engineers are integral to the success of Onclusive. You'll be an essential catalyst for Onclusive's success. Collaborating closely with our engineering, product, and core teams, you'll be entrusted with designing and implementing containerized runtime environments. These environments are the bedrock of efficient model development and deployment for ML/AI solutions, paving the way for predictive breakthroughs.\nYour responsibilities:Building and enhancing features within our machine learning platform to expedite ML-based solution development company-wide.Elevating system maintainability by establishing a unified infrastructure, streamlined orchestration, and vigilant monitoring.Mastering MLOps and CI/CD best practices to orchestrate seamless, automated build and deployment pipelines of our services.Harnessing your Unix-based systems knowledge to ensure the smooth functioning of ML/AI software and frameworks.Crafting illustrative example notebooks to empower machine learning engineers in leveraging our internal tools to streamline model research and development.Guiding and nurturing junior engineers, instilling them with MLOPs excellence and the intricacies of diverse frameworks we leverage in our day-to-dayPioneering research into open-source tools and industry-leading MLOps and Platform strategies, steering us toward top-tier technology solutions.\nWho you are:A degree (BS, MS, or Ph.D.) in Computer Science or a related field, accompanied by hands-on experience.You will have 5 years + using a similar tech stack.Proficiency in Python, showcasing your understanding of Object-Oriented Programming (OOP) principles.Solid knowledge of containerisation (Docker preferable)Experience working with Kubernetes.Experience in Infrastructure as Code (IAC) for AWS, with a preference for Terraform.Knowlede of Version Control Systems (VCS), particularly Git and GitHub, alongside familiarity with CI/CD, preferably GitHub Actions.Understanding of release management, embracing rigorous testing, validation, and quality assurance protocols.Good understanding of ML principlesExposure to deep learning tech-stacks like Torch / Tensorflow, and Transformers.\nWhat we can offer:We are a global fast growing company which offers a variety of opportunities for you to develop your skill set and career. In exchange for your contribution, we can offer you:Competitive salary and benefitsHybrid working in a team that is passionate about the work we deliver and supporting the development of those that we work withA company focus on wellbeing and work life balance including initiative’s such as flexible working and mental health support We want the best talent available, regardless of race, religion, gender, gender reassignment, sexual orientation, marital status, pregnancy, disability or age.""}, 'job_url': {'com.linkedin.voyager.jobs.ComplexOnsiteApply': {'unifyApplyEnabled': True, 'easyApplyUrl': 'https://www.linkedin.com/job-apply/3994587571'}}}","{'company_name': 'Onclusive', 'company_url': 'https://www.linkedin.com/company/onclusive'}",https://www.linkedin.com/jobs/view/3994587571/,"Artificial Intelligence (AI), Data Mining, Data Science, Learning, Machine Learning, Machine Tools, Pattern Recognition"
2,Data Scientist,EPAM Systems,"Pune, Maharashtra, India",False,"{'description': 'We are seeking a highly skilled Data Scientist to join our team.\n\nOur client is a leading provider of innovative solutions in the field of Business and Data Analysis. As a Data Scientist, you will be responsible for designing and implementing data science models and machine learning algorithms that solve complex problems and provide insights to our clients.\n\nResponsibilities\n\n\nDesign, develop, and implement novel data science models and machine learning algorithms that solve complex problems. This includes architectural design, data pre-processing, training, optimization, and evaluation of modelsCollaborate with data engineers and data scientists to collect, pre-process, and curate datasets suitable for trainingTrain and fine-tune machine learning/deep learning models using large-scale datasets and distributed computing frameworks. Optimize models for performance, efficiency, and scalabilityDesign and conduct experiments to evaluate the performance, robustness, and generalization of tune machine learning/deep learning models. Use appropriate metrics and statistical analysis to measure and interpret resultsPrepare technical documentation, including model architecture, implementation details, and experimental results. Communicate findings, insights, and recommendations to both technical and non-technical stakeholders\n\n\nRequirements\n\n\nBachelor’s or master’s degree in computer science, Data Science, Statistics, or related fieldMinimum of 3 to 5 years of experience is requiredSolid foundation in Machine Learning, Deep Learning, Computer Vision, NLP\u202fProficiency in Python\u202fExperience Deep learning frameworks like Tensorflow, Pytorch, Keras, Jax, etc.Experience with pandas, scikit-learn, matplotlib, spacy, statsmodel, etc.General understanding of data structures, algorithms, multi-threaded programming, and distributed computing conceptsKnowledge of statistical and algorithmic models as well as of fundamental mathematical concepts, such as linear algebra and probabilityFamiliarity with cloud services (AWS, Google Cloud, Azure)Excellent written and verbal communication skills\n\n\nWe offer\n\n\nInsurance Coverage Paid Leaves – including maternity, bereavement, paternity, and special COVID-19 leaves. Financial assistance for medical crisis Retiral Benefits – VPF and NPS Customized Mindfulness and Wellness programs EPAM Hobby ClubsHybrid Work Model Soft loans to set up workspace at home Stable workload Relocation opportunities with ‘EPAM without Borders’ programCertification trainings for technical and soft skills Access to unlimited LinkedIn Learning platform Access to internal learning programs set up by world class trainers Community networking and idea creation platforms Mentorship programs Self-driven career progression tool\n\n\n'}","{'employment_type': None, 'seniority_level': None, 'job_functions': [], 'industries': [], 'remote_work_allowed': False, 'job_description': {'description': 'We are seeking a highly skilled Data Scientist to join our team.\n\nOur client is a leading provider of innovative solutions in the field of Business and Data Analysis. As a Data Scientist, you will be responsible for designing and implementing data science models and machine learning algorithms that solve complex problems and provide insights to our clients.\n\nResponsibilities\n\n\nDesign, develop, and implement novel data science models and machine learning algorithms that solve complex problems. This includes architectural design, data pre-processing, training, optimization, and evaluation of modelsCollaborate with data engineers and data scientists to collect, pre-process, and curate datasets suitable for trainingTrain and fine-tune machine learning/deep learning models using large-scale datasets and distributed computing frameworks. Optimize models for performance, efficiency, and scalabilityDesign and conduct experiments to evaluate the performance, robustness, and generalization of tune machine learning/deep learning models. Use appropriate metrics and statistical analysis to measure and interpret resultsPrepare technical documentation, including model architecture, implementation details, and experimental results. Communicate findings, insights, and recommendations to both technical and non-technical stakeholders\n\n\nRequirements\n\n\nBachelor’s or master’s degree in computer science, Data Science, Statistics, or related fieldMinimum of 3 to 5 years of experience is requiredSolid foundation in Machine Learning, Deep Learning, Computer Vision, NLP\u202fProficiency in Python\u202fExperience Deep learning frameworks like Tensorflow, Pytorch, Keras, Jax, etc.Experience with pandas, scikit-learn, matplotlib, spacy, statsmodel, etc.General understanding of data structures, algorithms, multi-threaded programming, and distributed computing conceptsKnowledge of statistical and algorithmic models as well as of fundamental mathematical concepts, such as linear algebra and probabilityFamiliarity with cloud services (AWS, Google Cloud, Azure)Excellent written and verbal communication skills\n\n\nWe offer\n\n\nInsurance Coverage Paid Leaves – including maternity, bereavement, paternity, and special COVID-19 leaves. Financial assistance for medical crisis Retiral Benefits – VPF and NPS Customized Mindfulness and Wellness programs EPAM Hobby ClubsHybrid Work Model Soft loans to set up workspace at home Stable workload Relocation opportunities with ‘EPAM without Borders’ programCertification trainings for technical and soft skills Access to unlimited LinkedIn Learning platform Access to internal learning programs set up by world class trainers Community networking and idea creation platforms Mentorship programs Self-driven career progression tool\n\n\n'}, 'job_url': {'com.linkedin.voyager.jobs.ComplexOnsiteApply': {'unifyApplyEnabled': True, 'easyApplyUrl': 'https://www.linkedin.com/job-apply/3958017450', 'companyApplyUrl': 'https://jobs.welcome.epam.in/vacancy/data-scientist-bltd8e9f56fe529c7f3?utm_source=Linkedin.com&utm_medium=job_slots&utm_campaign=LinkedIn_Job_Wrapping_XML&utm_content=careers-india_bltd8e9f56fe529c7f3_en-us_Pune_India'}}}","{'company_name': 'EPAM Systems', 'company_url': 'https://www.linkedin.com/company/epam-systems'}",https://www.linkedin.com/jobs/view/3958017450/,"Algorithms, Communication, Computer Science, Data Science, Linear Algebra, Mathematics, Natural Language Processing (NLP), Oral Communication, Probability, Statistical Analysis"
